{
  "$schema": "https://json-schema.org/draft/2020-12/schema",
  "title": "Prospector topic group",
  "type": "object",
  "additionalProperties": false,
  "required": ["schema_version", "id", "title", "scope", "membership_basis", "paper_ids", "idea_ids", "design_ids"],
  "properties": {
    "schema_version": {"const": 1},
    "id": {"type": "string", "pattern": "^[a-z][a-z0-9-]*$"},
    "title": {"type": "string", "minLength": 1},
    "scope": {"type": "string", "minLength": 1},
    "membership_basis": {"type": "string", "minLength": 1},
    "paper_ids": {"type": "array", "minItems": 1, "uniqueItems": true, "items": {"type": "string"}},
    "idea_ids": {"type": "array", "uniqueItems": true, "items": {"type": "string"}},
    "design_ids": {"type": "array", "uniqueItems": true, "items": {"type": "string"}}
  }
}
