{
  "schema_version": 1,
  "id": "early-energy",
  "title": "Early energy and recombination",
  "scope": "Pre-recombination energy, onset/trigger mechanisms, perturbations and sound-horizon consequences.",
  "membership_basis": "Topic navigation from abstracts or reviewed sources; shared membership does not establish physical equivalence.",
  "paper_ids": [
    "arxiv:1306.3208v2",
    "arxiv:1811.04083v2",
    "arxiv:1910.10739v5",
    "arxiv:2111.07288v1",
    "arxiv:2112.00770v2",
    "arxiv:2202.08291v3",
    "arxiv:2209.15046v1",
    "arxiv:2401.08812v1",
    "arxiv:2408.03229v3",
    "arxiv:2411.09747v2",
    "arxiv:2502.08541v2",
    "arxiv:2605.26116v2",
    "arxiv:2609.37293v1",
    "arxiv:astro-ph/0601544v2"
  ],
  "idea_ids": [
    "constant-coupling-scalar-residual-floor",
    "ede-oscillating-scalar",
    "ede-slowly-rolling-scalar",
    "nede-trigger-perturbation-matching",
    "nede-triggered-first-order-transition",
    "positive-exponential-slope-variance-obstruction",
    "transient-pre-recombination-energy",
    "unified-scalar-steep-steeper-shallow"
  ],
  "design_ids": [
    "candidate-ede-fixed-endpoint-ruler",
    "candidate-nede-piecewise-background",
    "candidate-unified-scalar-source-consistency-and-slope-screen"
  ]
}
