{
  "schema_version": 1,
  "id": "baseline-reference",
  "title": "ΛCDM reference",
  "scope": "Full conditioned baseline and explicitly changed, limited implementation comparisons; calibrated/compressed input ancestry. Reference status is not a verdict on alternative cosmologies.",
  "membership_basis": "Explicit core-reference audit; source identity and targeted evidence, not equivalence or full-paper reading.",
  "paper_ids": [
    "arxiv:1807.06209v4",
    "arxiv:2503.14738v3",
    "arxiv:2202.04077v2",
    "arxiv:2112.03863v2",
    "arxiv:2112.03864v2",
    "arxiv:2112.04510v3",
    "arxiv:2112.01471v2",
    "arxiv:2110.03487v2",
    "arxiv:1907.12875v2",
    "arxiv:0910.2773v2",
    "arxiv:1104.2933v3",
    "arxiv:astro-ph/9709112v1",
    "arxiv:astro-ph/0701828v1",
    "arxiv:1606.00439v2",
    "arxiv:astro-ph/9603033v1",
    "arxiv:astro-ph/9506072v1",
    "arxiv:astro-ph/9911177v2",
    "arxiv:astro-ph/9909275v2",
    "arxiv:1801.08023v3",
    "arxiv:1509.06386v2"
  ],
  "idea_ids": [
    "planck-conditioned-base-lcdm",
    "bao-compressed-relative-ruler",
    "sn-standardized-distance-lineage",
    "massless-supplied-drag-comparison"
  ],
  "design_ids": [
    "candidate-lcdm-baseline-reference-audit",
    "candidate-lcdm-massless-conditional-comparison",
    "candidate-desi-dr2-full-compression-contract",
    "candidate-bounded-shared-charge-hhe",
    "candidate-perfect-fluid-band-transfer",
    "next05-released-fixed44-row3213-conditional-diagnostic-20261003"
  ]
}
